{
  "entitlement_id": "ent_11112222-3333-4444-5555-666677778888",
  "tenant_id": "ten_abcdef123456",
  "type": "artistic_generation_allowance",
  "state": "active",
  "offer_id": "artistic-project-12",
  "purchase_event_id": "evt_a1b2c3d4-e5f6-7890-abcd-ef1234567890",
  "created_at": "2026-07-26T09:30:00Z",
  "expires_at": "2026-08-26T00:00:00Z",
  "metadata": { "project_id": "proj_9f8e7d6c5b4a3210" }
}
